Stakeholder,Recommendation Symbol,Recommendation Type,Recommended Action,Target Variable,Optimization Objective,Expected Benefit,Implementation Cost / Burden,Acceptance Factors,Monitoring Variables,Example Recommendation,Simulation Placeholder
Students,Rec_student(t),Choice and routing recommendation,"Select vendor, menu, order time, or delivery option that improves satisfaction and reduces congestion","Vendor choice, menu choice, order timing, queue choice","Maximize satisfaction, nutrition, affordability, and convenience while reducing waiting time","Shorter queue, better nutrition, higher satisfaction, better demand distribution",Small behavioral adjustment; possible preference compromise,"Trust in recommendation, menu preference, price sensitivity, distance, habit, perceived benefit","Waiting time, satisfaction score, nutrition score, affordability score, choice acceptance rate",Choose Vendor_B at 12:15 because queue is shorter and nutrition score is acceptable,Student recommendation acceptance rate (%)
Vendors,Rec_vendor(t),Production and menu-mix recommendation,"Adjust production quantity, menu mix, price promotion, staffing, and preparation timing","Production quantity Q_v(t), mission intensity M_v(t), menu mix, staffing level","Maximize demand fulfillment, profit, food quality, and utilization while minimizing waste","Higher sales, lower leftover, lower shortage, better capacity utilization","Ingredient cost, labor adjustment, menu preparation complexity, autonomy cost","Expected profit, trust in MSRS, risk tolerance, ingredient availability, labor availability","Meals produced, meals served, leftover, waste, profit, vendor utilization, recommendation acceptance",Produce 165 meals and increase healthy-menu share by 10% during exam week,Vendor production error reduction (%)
Suppliers,Rec_supplier(t),Supply and delivery synchronization recommendation,"Adjust ingredient delivery quantity, delivery timing, stock allocation, and sourcing plan","Delivery quantity, delivery time, stock allocation, supply mission intensity M_s(t)",Maximize supply reliability and inventory turnover while minimizing stockout and spoilage,"Reduced supplier bottleneck, improved vendor readiness, lower spoilage, better delivery utilization","Logistics cost, early delivery cost, inventory holding cost, routing adjustment","Delivery feasibility, expected revenue, logistics capacity, stock availability, relationship trust","Delivery reliability, stockout rate, supplier utilization, spoilage, delivery delay",Advance vegetable delivery by one time step and increase quantity by 15% before lunch surge,Supplier reliability score
Delivery,Rec_delivery(t),Routing and capacity allocation recommendation,"Assign delivery routes, adjust delivery capacity, batch orders, or redirect riders to high-demand zones","Route assignment, delivery batch size, delivery timing, delivery mission intensity M_d(t)",Minimize delivery delay and idle time while maximizing coverage and service reliability,"Lower delivery time, better order fulfillment, reduced rider idle time, improved online service quality","Route change cost, fuel or energy cost, rider workload, coordination burden","Route feasibility, rider availability, expected fee, traffic condition, delivery platform trust","Delivery time, completed deliveries, route efficiency, rider utilization, delivery satisfaction",Allocate two additional riders to the north campus route during lunch peak,Average delivery delay (minutes)
University,Rec_university(t),Policy and governance recommendation,"Adjust subsidy, vendor allocation, nutrition target, sustainability rule, or facility support","Subsidy level, policy constraint, facility allocation, EVI weights, nutrition target","Maximize student welfare, mission achievement, affordability, sustainability, and vendor viability","Improved institutional mission, better affordability, healthier meals, reduced ecosystem risk","Budget cost, administrative complexity, fairness concerns, policy approval time","Budget availability, institutional priority, evidence quality, stakeholder fairness, regulatory alignment","Mission achievement, affordability, student satisfaction, vendor viability, sustainability score, EVI",Increase temporary meal subsidy by 10% under inflation scenario to preserve affordability,Policy impact on EVI
Operator,Rec_operator(t),System configuration and experiment recommendation,"Select MSRS policy, adjust model parameters, run scenario tests, update dashboard, or trigger alerts","Policy π_k, scenario set, EVI weights, recommendation frequency, model parameters","Improve recommendation quality, robustness, transparency, and learning across scenarios","Better coordination, stronger evidence, improved experiment reproducibility, faster response to disruption","Compute cost, model maintenance, data validation effort, dashboard complexity","Data quality, model confidence, stakeholder trust, computational feasibility, governance approval","Prediction error, policy rank, robustness index, recommendation acceptance, dashboard usage",Run multi-shock scenario and switch from cost-first to balanced-EVI policy,Robustness ranking improvement
Regulator,Rec_regulator(t),Compliance and oversight recommendation,"Adjust inspection priority, compliance threshold, audit frequency, or safety-warning trigger","Inspection intensity, compliance threshold, audit priority, penalty level","Maximize safety, fairness, compliance, trust, and environmental accountability","Reduced safety risk, improved trust, better compliance, lower institutional risk","Inspection cost, enforcement workload, administrative burden, stakeholder resistance","Legal authority, risk evidence, audit capacity, institutional support, urgency of incident","Compliance rate, safety incidents, audit findings, environmental violations, trust score",Prioritize inspection for vendors with repeated waste and hygiene anomalies,Compliance risk reduction (%)
All stakeholders,Rec(t) = {Rec_i(t)},Coordinated recommendation vector,"Synchronize stakeholder actions across demand, production, supply, delivery, governance, and regulation","M_i(t), Q_i(t), A_i(t), RMOV_i(t), PSKVE flows, EVI(t)","Maximize ecosystem value subject to stakeholder constraints, mission goals, and scenario conditions","Higher mission achievement, improved sustainability, better resilience, reduced systemic inefficiency","Coordination cost, data-sharing cost, autonomy cost, computational cost","Trust, perceived fairness, expected benefit, implementation cost, governance legitimacy","EVI, mission synchronization index, acceptance rate, waste reduction, resilience, satisfaction, profit","Students shift demand, vendors adjust production, suppliers advance delivery, university activates subsidy",System-level EVI improvement (%)
